houseName,houseScale,houseArea,houseLayers,houseDirect,builtDate,owner,community,detailAddress,price
(高层)(南向2居室)(户型方正)(温馨舒适),2室1厅,87㎡,高层（共25层）,南向,2009年建,高春利,北纬40度,望京-北纬40度(朝阳)来广营西路7号院,78160元/㎡
"亦庄金茂府清退中叠一套,有钱有资格优先 同看海晏春秋熙悦林语",4室3厅,230㎡,中层（共6层）,南北向,2020年建,王志豪,亦庄金茂府,亦庄-亦庄金茂府,53652元/㎡
"春荫园精装南北两居,满五年普通住宅,精装修",2室1厅,127.59㎡,低层（共12层）,南北向,2004年建,黄平,春荫园,世纪城-世纪城春荫园蓝晴路春荫园8号,103456元/㎡
有钥匙 誉天下别墅临水独栋落地窗业主移民出国临德威,独栋,卧室：5个,花园：300平米,405㎡,南向,袁华超,誉天下,中央别墅区-誉天下,34074元/㎡
新出翠叠园四居 带车位 三面采光 近综合一体街 近,4室2厅,222.41㎡,低层（共13层）,南北向,2004年建,黄平,翠叠园,世纪城-世纪城翠叠园老营房路蓝靛厂中路东南角,110156元/㎡
"极简舒适绿色科技系统住宅,恒温恒湿恒氧,低于市价200万",4室2厅,177㎡,中层（共22层）,南北向,2018年建,邓永梅,通州万国城MOMA,九棵树-通州万国城MOMA,62485元/㎡
"新出捡漏房,397万115平米豪华装修,同林肯时代住宅金色漫",3室2厅,115㎡,中层（共16层）,南北向,2011年建,王志豪,林肯公园C区住宅,亦庄-林肯公园C区住宅,43478元/㎡
北苑地铁步行百步杨庄北街板楼中间层南北三居室,3室1厅,84.26㎡,中层（共6层）,南北向,2000年建,朱梦玲,杨庄北街3号院,通州北苑-杨庄北街3号院杨庄北街3号院,43674元/㎡
"晴雪园板楼通透两居室,高层观景,户型方正。",2室2厅,123.69㎡,高层（共12层）,南北向,2005年建,黄平,晴雪园,"世纪城-世纪城晴雪园蓝靛厂中路,火器营地铁站西侧",111569元/㎡
"保密房源万达商圈为邻,万国城O,科技住宅,恒温恒湿恒氧",3室2厅,141㎡,低层（共15层）,南北向,2019年建,郝华龙,通州万国城MOMA,九棵树-通州万国城MOMA,51063元/㎡
新出观山园四居 地下车位 视野好 三面采光 有钥匙,4室2厅,211.01㎡,低层（共11层）,南北向,2004年建,黄平,观山园,"世纪城-世纪城观山园蓝靛厂中路,火器营地铁站西侧",107103元/㎡
南北通透板楼四居室 双卧朝南 中高层采光好,4室2厅,206.29㎡,中层（共16层）,南北向,2002年建,黄平,世纪金源国际公寓,世纪城-世纪金源国际公寓海淀区板井路69号,71258元/㎡
"东三环国贸新房豪装三居 明厨卫 前后观景,同看其他特.价房源",3室2厅,151.2㎡,高层（共8层）,南北向,2012年建,王志豪,鸿坤花语墅,大望路-鸿坤花语墅,79761元/㎡
奥林匹克公园、倚林佳园上叠别墅254平5居室、1540万、司法拍卖、,独栋,卧室：5个,无花园,254㎡,南向,马茹韬,倚林佳园别墅,奥林匹克公园-倚林佳园别墅洼里乡龙王堂林萃路西侧,62992元/㎡
垡头西里二区 钢混全南两居 中间楼层 精装 采光足,2室1厅,54.97㎡,中层（共6层）,南向,1996年建,史健,垡头西里,垡头-垡头西里东四环四方桥南1公里垡头,47116元/㎡
"一期清退房,高新科技系统,恒温恒湿恒氧,低于市价200速联",4室2厅,177㎡,中层（共22层）,南北向,2018年建,王志豪,通州万国城MOMA,九棵树-通州万国城MOMA,55084元/㎡
"安家)万国城,高新科技系统,恒温恒湿恒氧,低于市价200万",4室2厅,177㎡,中层（共22层）,南北向,2018年建,邓永梅,通州万国城MOMA,九棵树-通州万国城MOMA,62711元/㎡
佣金1.2 六层板楼带电梯 满伍惟一 大餐厅 闹中取静 品质,3室2厅,165.84㎡,中层（共6层）,南北向,2008年建,邓建勋,玺萌公馆,马家堡-玺萌公馆镇国寺北街8号院,79474元/㎡
"三环内精装修平墅,工抵房价能聊有钱有资格的优先",独栋,卧室：4个,无花园,313㎡,南向,王志豪,懋源·璟岳,丽泽桥-懋源·璟岳三环内 万柳桥内环辅路向西500米,87859元/㎡
通州万国城O 经典户型 视野开阔 观景房 科技智能小区,3室2厅,137㎡,高层（共18层）,南北向,2017年建,邓永梅,通州万国城MOMA,九棵树-通州万国城MOMA,51021元/㎡
"亦庄核心区一手精装现房,家电单价仅4万先到先得清盘特价",3室2厅,115㎡,高层（共15层）,南北向,2017年建,王志豪,中国铁建花语金郡,亦庄-中国铁建花语金郡,43478元/㎡
陶然亭公园 一瓶 高层观东山绿化 安静不临街 户型方正 随时,3室1厅,153.08㎡,高层（共13层）,东向,2009年建,李晋林,一瓶,陶然亭-一瓶(西城)陶然亭路2号院,99947元/㎡
"房主到其他城市发展,370万急售合生麒麟社1居室",1室0厅,84.51㎡,低层（共31层）,东北向,2010年建,焦小华,望京合生麒麟社公寓,望京-望京合生麒麟社公寓,43781元/㎡
一手关系户急售300万!可谈带家电床椅柜林肯时代住宅国锐金嵿,3室2厅,117㎡,中层（共16层）,南向,2011年建,王志豪,林肯公园C区住宅,亦庄-林肯公园C区住宅,39829元/㎡
佣金1.2房价可大议南四环内联排别墅4号线10号线角门西,联排,卧室：3个,花园：100平米,262㎡,南向,张少军,未来假日花园,马家堡-未来假日花园南四环中路马家堡出口,57633元/㎡
近 清枫华景园旁 南向2居室带落地窗 高层采光视野好,2室2厅,106.27㎡,中层（共15层）,南向,2006年建,杜玲玲,文成杰座,学院路-文成杰座林业大学北路18号院,78667元/㎡
"西区朝南户型,采光好,户型方正,无浪费面积。",2室1厅,150㎡,中层（共29层）,西南向,2005年建,韩静,建外SOHO东区,国贸-建外SOHO东区,42000元/㎡
"欧式环保装修,南向双套房客厅设,全屋定装修,带独立儿童乐园",4室2厅,261㎡,低层（共18层）,南北向,2015年建,刘春芹,保利海德公园,知春路-保利海德公园(海淀)西土城路1号院,149042元/㎡
"金茂府品质升级,广渠路旁学教旁,核心位置绿色科技住宅配套成熟",4室2厅,177㎡,高层（共22层）,南北向,2017年建,邓永梅,通州万国城MOMA,九棵树-通州万国城MOMA,61525元/㎡
中关村商圈 唐宁 精装修 北四环 清华北大 科技园,4室2厅,338.06㎡,低层（共22层）,东南向,2019年建,陶彬,唐宁ONE,五道口-唐宁ONE中关村甲3号,143406元/㎡
宣武门西大街 正规两居室 中间楼层电梯直达,2室1厅,58.62㎡,中层（共12层）,东西向,1970年建,王越,宣武门西大街,宣武门-宣武门西大街,106960元/㎡
急售天悦壹号20平大4居全明东边户 金府大院懋源璟岳德贤,5室3厅,173.93㎡,高层（共19层）,南北向,2019年建,王志豪,中粮天恒·天悦壹号,新发地-中粮天恒·天悦壹号南四环地铁新宫站南500米,73592元/㎡
北五环亚奥 精装现房洋房 关系户预留房仅此我有同华贸铂金墅,3室1厅,219㎡,中层（共5层）,南北向,2020年建,王志豪,天润福熙大道,北苑-天润福熙大道,66940元/㎡
西钓鱼台嘉园 3室2厅2卫 格局方正 客厅朝南,3室2厅,160㎡,中层（共17层）,南北向,2006年建,姜海旭,西钓鱼台嘉园,航天桥-西钓鱼台嘉园海淀西三环钓鱼台村1号,112437元/㎡
"三环内在售的科技精装住宅,大宽庭设计南北通透。小区中间仅一套",3室2厅,190㎡,低层（共16层）,南北向,2019年建,王志豪,葛洲坝北京中国府,花乡-葛洲坝北京中国府,86842元/㎡
朝阳邻水独栋大独栋)前二后三全地上全明格局)随时看房,独栋,卧室：4个,无花园,416㎡,东向,张刘邦,康城暖山,管庄-康城暖山双桥东路63号院,62500元/㎡
朝阳邻水独栋大独栋)前二后三全地上全明格局)随时看房,独栋,卧室：4个,无花园,416㎡,东向,张刘邦,康城暖山,管庄-康城暖山双桥东路63号院,62500元/㎡
"通州改善必看科技豪装四居,全屋进口品牌家电交房",4室2厅,177㎡,低层（共24层）,南北向,2019年建,邓永梅,通州万国城MOMA,九棵树-通州万国城MOMA,55932元/㎡
"8号线南海子公园旁,6层小洋楼158平米东边户精装4居室带车",3室2厅,158㎡,高层（共15层）,南北向,2020年建,王志豪,中国铁建花语金郡,亦庄-中国铁建花语金郡,53797元/㎡
"绿建三星认证)万国城2号楼,电梯入户,关系户房,可省300万",3室2厅,150㎡,中层（共26层）,南北向,2020年建,邓永梅,通州万国城MOMA,九棵树-通州万国城MOMA,59333元/㎡
"6层洋房一梯一户,智能精装下跃实得260平,南北同华贸铂",4室4厅,153.21㎡,中层（共5层）,南北向,2020年建,王志豪,天润福熙大道,北苑-天润福熙大道,88767元/㎡
一梯两户板楼 可以改小三居室 中高层 落地窗阳台 带车位,2室2厅,115.6㎡,中层（共6层）,南北向,2001年建,栾亚鹏,美丽园,曙光-美丽园四季青桥南1500米营慧寺车站处,103719元/㎡
客厅面宽4米9 格局方正 奥林匹克森林公园,2室2厅,108.84㎡,低层（共15层）,南北向,2005年建,李海义,融域,奥林匹克公园-融域域清街2号院,86365元/㎡
"高层3居室,全新房。19年底交房次新盘。中骏天辰,紫御香山",3室2厅,137㎡,高层（共15层）,东西向,2019年建,刘春芹,中骏天宸,西直门-中骏天宸德胜门北800米,175182元/㎡
"三环现房拎包入住高楼层无遮挡,现房关系户预留房没速联",3室2厅,138㎡,高层（共26层）,东向,2019年建,王志豪,首开住总熙悦安郡,十八里店-首开住总熙悦安郡,72463元/㎡
保利南区 6层 南北通透 精装修 采光好,2室2厅,90㎡,高层（共6层）,南北向,2006年建,曹松宇,保利花园,少年宫-保利花园,24222元/㎡
西辛北区 三居 300万 单价低 业主已经订房 大商量!!,3室1厅,100㎡,高层（共6层）,南北向,1998年建,梁建,西辛北区,顺义城-西辛北区,31200元/㎡
"清退小户型三居室朝南,科技精装准现房有钱有资格的优先",4室2厅,150㎡,高层（共11层）,南北向,2014年建,王志豪,中国阙,运河大街-中国阙,53733元/㎡
实楼 刚刚清退2号楼170平带车位一起转让 景观中层户就一套,4室2厅,170㎡,高层（共17层）,南北向,2017年建,邓永梅,通州万国城MOMA,九棵树-通州万国城MOMA,57058元/㎡
"西辛北区,正规2居室,257万!价格大商量!",2室1厅,74.24㎡,低层（共5层）,南北向,1995年建,梁建,西辛北区,顺义城-西辛北区,34617元/㎡
"(优选)保利一层下跃,业主改造的好,看房方便",2室2厅,88.14㎡,低层（共8层）,南北向,2010年建,李浩南,保利西山林语,西北旺-保利西山林语(海淀)保利西山林语别墅,84864元/㎡
北京全境1手 丽都壹号南向1居,1室1厅,71㎡,高层（共21层）,南向,2017年建,吕开东,丽都壹号,酒仙桥-丽都壹号,85211元/㎡
"钓云台刚出来的新房源194平米特价四居室,仅一套速电联",4室2厅,196㎡,高层（共12层）,南北向,2016年建,王志豪,钓云台,丽泽桥-钓云台西三环康庄东路西侧,88265元/㎡
"怡馨家园,南北通透2居,价格大商量!!",2室1厅,83.72㎡,中层（共18层）,南北向,2004年建,梁建,怡馨家园,顺义城-怡馨家园新顺南大街26号,48614元/㎡
圈 复地官邸南北3居 德国古翠铜 3.4米观光电梯,3室2厅,361㎡,中层（共10层）,南北向,2010年建,胡虹,Peking Hou,大望路-首府会朝阳区西大望路甲20号院,69252元/㎡
好房子值得一看.适合.买到就到.错过可就没有了,3室2厅,144㎡,中层（共5层）,南北向,2016年建,高西娥,北京城建琨廷,窦店-北京城建琨廷提香草堂高尔夫球场西侧1.4公里,28819元/㎡
朝青 罗马嘉园西区高层北向次顶层正规一居室近大悦城6号线,1室1厅,55.33㎡,高层（共11层）,北向,2006年建,成森,珠江罗马嘉园西区,朝青-珠江罗马嘉园西区朝阳北路107号院,77715元/㎡
昆玉河边 板楼 眼镜户型 带2车位 安静 看房方便,5室3厅,208㎡,高层（共6层）,东西向,2002年建,周凤志,颐安嘉园,八里庄-颐安嘉园海淀西八里庄西三环花园桥向西500米,88942元/㎡
好房出售 建外 东北两居 五年 在就就这套房,2室2厅,137.3㎡,中层（共32层）,东北向,2005年建,韩静,建外SOHO西区,国贸-建外SOHO西区东三环中路39号,45156元/㎡
"10号线丰台站 三环新城,满五商品房,户型实用,全明格局",1室1厅,53.92㎡,中层（共29层）,东西向,2015年建,王宏远,三环新城,玉泉营-三环新城丰桥路8号院三环新城,59347元/㎡
润枫锦尚 93平米南北两居室 412万,2室1厅,93.66㎡,高层（共10层）,南北向,2015年建,代宏郡,润枫锦尚,旧宫-润枫锦尚,43988元/㎡
"吉晟别墅 新上三期联排别墅,中间位置,出行方便",独栋,卧室：4个,无花园,245.01㎡,南向,柳博,吉晟别墅,"回龙观-吉晟别墅(昌平)吉晟别墅,回龙观镇吉晟别墅",59181元/㎡
"三环朝阳精装现房,新房没住过刚清退,南北通透东边户仅一套",3室2厅,138.9㎡,中层（共18层）,南北向,2016年建,王志豪,首开住总熙悦安郡,十八里店-首开住总熙悦安郡,64794元/㎡
怡馨家园 3室2厅1卫 中高层 视野好 业主换房 着急用钱!,3室1厅,110.74㎡,中层（共9层）,南北向,2004年建,梁建,怡馨家园,顺义城-怡馨家园新顺南大街26号,42441元/㎡
绿港一区 大三居双卫 单价三万九 格局好 诚心卖 有钥匙,3室2厅,135.65㎡,低层（共20层）,南北向,2006年建,邵枫,金汉绿港,顺义城-金汉绿港顺沙路和右堤路交汇处南侧,39071元/㎡
商圈 复地别墅上叠5居4卫 德国古翠铜 邱德光先生设计,5室3厅,377㎡,高层（共3层）,南北向,2010年建,胡虹,Peking Hou,大望路-首府会朝阳区西大望路甲20号院,87533元/㎡
房子不临街!看! 阳光直射!前面没有这挡 !视野好!,1室1厅,78.42㎡,低层（共12层）,南向,2003年建,徐晓仲,新裕家园,崇文门-新裕家园崇外大街磁器口向东300米路南,105840元/㎡
)合院价格买法式独栋)随时可看10套起,独栋,卧室：4个,花园：400平米,427.6㎡,东向,张刘邦,格拉斯小镇,北关-格拉斯小镇格拉斯路与滨河路交叉点东南角,60804元/㎡
11.11)地贴北苑300 洋房 精装现房 50%绿化,3室2厅,137㎡,中层（共5层）,南北向,2020年建,邓永梅,天润福熙大道,北苑-天润福熙大道,75182元/㎡
"怡馨家园 ,2室2厅,价格大商量!!!",2室1厅,87.04㎡,低层（共11层）,南北向,2004年建,梁建,怡馨家园,顺义城-怡馨家园新顺南大街26号,43543元/㎡
三环195平精装平层 价能聊 同钓云台紫辰院中海甲叁号院中国,独栋,卧室：4个,无花园,195㎡,南向,王志豪,懋源·璟岳,丽泽桥-懋源·璟岳三环内 万柳桥内环辅路向西500米,90666元/㎡
(特价一套)门头沟明星楼盘任志强华远开发特价900万仅有一套,4室2厅,191㎡,中层（共24层）,南北向,2017年建,郭旺,华远裘马四季,"大峪-华远裘马四季龙泉镇新桥大街西侧,区政府正对面",47120元/㎡
双卧朝南!看! 阳光直射!(户型无浪费) !方便看!,3室1厅,129.63㎡,高层（共16层）,南北向,2003年建,徐晓仲,新裕家园,崇文门-新裕家园崇外大街磁器口向东300米路南,104913元/㎡
西钓鱼台嘉园 3室2厅2卫 品质小区 客厅朝南,3室2厅,160㎡,中层（共17层）,南北向,2006年建,于春丽,西钓鱼台嘉园,航天桥-西钓鱼台嘉园海淀西三环钓鱼台村1号,99375元/㎡
远见名苑 正规两居室 落地窗 正对莲花河 观景房,2室2厅,79.2㎡,低层（共21层）,西南向,2005年建,王明明,远见名苑,广安门-远见名苑红居北街与莲花河东侧路交叉点东北角,83080元/㎡
"真房真价 中式四合院 独栋 200平院,刚清退先到先得速",独栋,卧室：5个,花园：120平米,420㎡,南向,王志豪,兴创荣墅,亦庄-兴创荣墅采育镇采凤路与采辛路交口东侧,19047元/㎡
好房!热!福熙大道 朝青奥北板块 精装洋房现房 近地铁富力城,5室2厅,219.5㎡,中层（共26层）,南北向,2020年建,邓永梅,天润福熙大道,北苑-天润福熙大道,59225元/㎡
"(优选)温泉叠拼四居室,一层,南北通透,楼上楼下各两卧",5室2厅,281.86㎡,低层（共3层）,南北向,2011年建,李浩南,北辰香麓,温泉镇-北辰香麓(海淀)西山后新区温泉镇,47186元/㎡
圈 德国古翠铜 3.4米 边户3居4卫带47平,3室3厅,368.31㎡,低层（共9层）,南北向,2009年建,胡虹,Peking Hou,大望路-首府会朝阳区西大望路甲20号院,95028元/㎡
"东南小区院内一层三居室,新楼大客厅,居家品志,随时看房",3室2厅,119.21㎡,低层（共6层）,南北向,2014年建,温光彬,中科院东南小区,中关村-中科院东南小区中关村甲392,119788元/㎡
颐源居 4室2厅2卫 格局方正 品质小区,4室2厅,176㎡,高层（共9层）,南北向,2001年建,于春丽,颐源居,公主坟-颐源居西三环羊坊店颐源居,105113元/㎡
建外西区 繁华地段 双轨交通 高层无遮挡采光好,2室1厅,138㎡,低层（共29层）,北向,2005年建,韩静,建外SOHO西区,国贸-建外SOHO西区东三环中路39号,45652元/㎡
"330平电梯入户,万科精装叠拼别墅,50平",独栋,卧室：5个,无花园,330㎡,东向,李伟,翡翠西湖别墅,京石高速-翡翠西湖别墅,24242元/㎡
柏林爱乐二期南向两居室中间层简单装修,2室1厅,100.7㎡,中层（共22层）,南向,2007年建,王吉帅,柏林爱乐二期,管庄-柏林爱乐二期管庄路口往北600米,54518元/㎡
业主赔钱卖 三居室 五层洋房 5米大面宽 福熙大道,3室2厅,137㎡,中层（共5层）,南北向,2018年建,邓永梅,天润福熙大道,北苑-天润福熙大道,86131元/㎡
远见名苑 正规两居室 落地窗 正对莲花河 观景房,2室2厅,79.2㎡,低层（共21层）,西南向,2005年建,崔志刚,远见名苑,广安门-远见名苑红居北街与莲花河东侧路交叉点东北角,83080元/㎡
西三环 翠微路 颐源居小区 全明格局,3室2厅,142.11㎡,高层（共27层）,东南向,2000年建,于春丽,颐源居,公主坟-颐源居西三环羊坊店颐源居,99922元/㎡
长椿街二环内 南北通透两居室 全明格局中间楼层,2室1厅,77.99㎡,中层（共5层）,南北向,1964年建,王越,西便门内大街79号院,天宁寺-西便门内大街79号院西便门内大街79号院,89755元/㎡
"南向两居室,3万/平装修标准,国贸次新盘,低600万",2室1厅,188㎡,低层（共24层）,南向,2015年建,杜闯,梵悦108,国贸-梵悦108国贸桥东南角建国路乙108号,106329元/㎡
"推门见海的, 精装,霞公府,长安太和",4室2厅,203㎡,高层（共1层）,南向,2016年建,刘永慧,东明胡同,德胜门-东明胡同德内大街后海西沿,140394元/㎡
西钓鱼台嘉园 5室2厅3卫 主卧朝南 客厅朝南,6室2厅,355.67㎡,低层（共22层）,南北向,2005年建,于春丽,西钓鱼台嘉园,航天桥-西钓鱼台嘉园海淀西三环钓鱼台村1号,92782元/㎡
夜景直观丽泽商务区!全南 双卫 看房方便,3室2厅,138㎡,低层（共28层）,南向,2003年建,崔志刚,欧园北欧印象,马连道-欧园北欧印象马连道路80号院,89130元/㎡
后沙峪 双裕小区82平大两居 总价285!!!单价仅34!,2室1厅,83㎡,高层（共6层）,南北向,2004年建,刘东旭,双裕小区,后沙峪-双裕小区,34337元/㎡
类独栋 干挂石材外立面 四卧朝南 使用650平方米 小区环境,独栋,卧室：5个,无花园,378㎡,东向,陈枣花,远洋天著别墅,亦庄-远洋天著别墅东五环大羊坊桥东900米,42328元/㎡
美凯龙爱家房源 云龙家园 婚房 精装修,3室2厅,70.42㎡,高层（共6层）,南北向,2002年建,李春艳,云龙家园,旧宫-云龙家园,39619元/㎡
美凯龙爱家 国贸SOHO现代城三居 户型方正 业主诚意出售,3室1厅,148.9㎡,低层（共28层）,西向,2000年建,王森,SOHO现代城,大望路-SOHO现代城(朝阳)建国路88号院,49026元/㎡
精装修 小区环境幽静 看房提前联系 满五 只交契税,2室1厅,70.8㎡,中层（共15层）,南向,2008年建,沈涛,金隅七零九零,梨园-金隅七零九零,43644元/㎡
必看好房 燕西华府东边大 豪装450万家电 期待有缘人,独栋,卧室：6个,无花园,350㎡,南向,段亚超,燕西华府,京石高速-燕西华府王佐镇青龙湖公园东1500米,28457元/㎡
万国城 第五代科技住宅 恒温 恒湿 恒氧 团购价 特价房,4室2厅,177㎡,中层（共22层）,南北向,2018年建,牛靖靖,通州万国城MOMA,九棵树-通州万国城MOMA,63841元/㎡
北五环亚奥 精装现房 高层+洋房 智慧社区法式风格 朝阳公园,3室1厅,219㎡,中层（共5层）,南北向,2020年建,邓永梅,天润福熙大道,北苑-天润福熙大道,63926元/㎡
"新出!南北通透板楼四居,客厅双主卧朝南,有车库,看房有钥匙!",4室2厅,192㎡,中层（共7层）,南北向,2001年建,赵景红,颐安嘉园,八里庄-颐安嘉园海淀西八里庄西三环花园桥向西500米,100520元/㎡
费.用.一.个.点鲁谷村满5年住房南北通透三居室/户型好,3室1厅,87.11㎡,高层（共6层）,南北向,1997年建,马永利,鲁谷村,鲁谷-鲁谷村(石景山)鲁谷东街鲁谷村,55676元/㎡
"赏星观月.君山独栋,385平米精装修,900万,随时看房",独栋,卧室：5个,花园：200平米,385㎡,南向,仝兆彦,阳光城君山墅,密云水库别墅区-阳光城君山墅,24155元/㎡
"新装未住,君山别墅,北美风格,400平米1100万,随时看房",独栋,卧室：4个,花园：300平米,397㎡,南向,仝兆彦,阳光城君山墅,密云水库别墅区-阳光城君山墅,23929元/㎡
剑桥郡一期大两居 主卧带飘窗 楼间距宽 中间楼层 采光好 随,2室2厅,85㎡,中层（共18层）,南向,杜玉琴,,永定河孔雀城剑桥郡,固安-永定河孔雀城剑桥郡大广高速(固安出口)西侧,12352元/㎡
西城 椿树馆 广外南街 西南两居室 满五年 诚心售,2室1厅,79㎡,低层（共13层）,南北向,1998年建,王明明,广南小区,"白纸坊-广南小区白纸坊桥西北角,广外南街",73417元/㎡
双裕东区采光好婚房装修全明格局 急0 售,2室1厅,72㎡,高层（共6层）,南北向,2004年建,刘东旭,双裕小区,后沙峪-双裕小区,37500元/㎡
北五环亚奥 精装现房高层+洋房智慧社区法式风格望京直降180,3室1厅,219㎡,中层（共5层）,南北向,2020年建,邓永梅,天润福熙大道,北苑-天润福熙大道,81643元/㎡
佣金1.2 南北通透 正规大四居 满伍惟一 物业管理严格,4室2厅,192.24㎡,低层（共15层）,南北向,2006年建,邓建勋,恋日花都,草桥-恋日花都,78027元/㎡
"君山别墅,精装南入户,417平米美式独栋仅890万",独栋,卧室：6个,花园：500平米,417.5㎡,南向,仝兆彦,阳光城君山墅,密云水库别墅区-阳光城君山墅,21317元/㎡
"荣丰2008 二环边开间 少花钱好选择,总价底原 高",1室0厅,19.2㎡,低层（共26层）,东向,2006年建,王明明,荣丰2008,广安门-荣丰2008广安门外大街305号院,155208元/㎡
"单层面积大,180.正观园林水系,客户清退可看实房",独栋,卧室：4个,无花园,304.6㎡,南向,郭晓强,海晏春秋,亦庄-海晏春秋地铁8号线瀛海站西300米,33486元/㎡
西三环北路86号 带电梯大三居,3室2厅,90.95㎡,中层（共12层）,东西向,何朝华,,西三环北路86号院,航天桥-西三环北路86号院西三环北路86号院,102253元/㎡
香花畦3室2厅2卫小区中心 中间楼层看房方便,3室2厅,146.6㎡,中层（共8层）,南向,2006年建,刘东旭,香花畦,后沙峪-香花畦后沙峪镇东庄村香江北路1号,45497元/㎡
保密房源 万国城O 精装修 南北通透 科技住宅,3室2厅,137㎡,中层（共2层）,南北向,2019年建,郝华龙,通州万国城MOMA,九棵树-通州万国城MOMA,57664元/㎡
名都园必看 精装独栋 有钥匙随时看 我拍的照片 房况顶呱呱,独栋,卧室：5个,花园：1平米,228㎡,南向,叶攀,名都园别墅,中央别墅区-名都园别墅,82456元/㎡
"亚运村高品质社区,8000平园林,社区绿化环境好,人文素质高",2室1厅,106.9㎡,低层（共30层）,西北向,2008年建,郭树伟,保利金泉广场,亚运村-保利金泉广场,74649元/㎡
西城 椿树馆 广外南街 西南两居室 满五年 诚心售,2室1厅,79㎡,低层（共13层）,南北向,1998年建,崔志刚,广南小区,"白纸坊-广南小区白纸坊桥西北角,广外南街",73417元/㎡
老客户清退只能我卖朝阳区北苑 精装现房 即买即住同珠江中国阙,4室3厅,227.7㎡,高层（共27层）,南北向,2020年建,邓永梅,天润福熙大道,北苑-天润福熙大道,65876元/㎡
宾阳里正规2居室小区环境好低总价,2室1厅,76㎡,高层（共6层）,南北向,2006年建,王桂青,宾阳里,宾阳-宾阳里新东路北段法制公园附近,21052元/㎡
"福熙大道北区,位置安静观景,全新装修保持好,双明卫!",3室2厅,170㎡,低层（共31层）,西南向,2012年建,关晓羽,天润福熙大道,北苑-天润福熙大道,67647元/㎡
挂牌 着急 只要看中 价格商量不是问题,3室2厅,121.6㎡,中层（共9层）,南北向,2013年建,朱国英,徜徉嘉园5号院,长阳-徜徉嘉园5号院(房山)祥云街5号院,51726元/㎡
"荣丰2008 二环边开间 少花钱好选择,总价底原 高",1室0厅,19.2㎡,低层（共26层）,东向,2006年建,崔志刚,荣丰2008,广安门-荣丰2008广安门外大街305号院,155208元/㎡
"(姜东精推) 毛坯房,有钥匙,随时签约!",独栋,卧室：4个,无花园,300.6㎡,南向,姜东,御汤山,小汤山-御汤山,49900元/㎡
